{"$schema":"../../../schemas/v2/federation-package-v2.schema.json","build":{"build_a_records_sha256":"6aa0421e45ce75dd906dd3493bdd409c5eb9d9933ffb2ffebeae197011dd1f76","build_b_records_sha256":"6aa0421e45ce75dd906dd3493bdd409c5eb9d9933ffb2ffebeae197011dd1f76","builder_path":"scripts/build-backend-v2-federation.py","builder_sha256":"63ac44b62046cab19fa669296dc573a953c4c916c9de494aad076f694697007d","command":["python","-B","scripts/build-backend-v2-federation.py","--output","<OUTPUT>"],"deterministic_replay":"pass"},"canonical_serialization":{"authority":"records.jsonl","encoding":"UTF-8","json_object_encoding":"UTF-8 compact JSON with lexicographically sorted object keys","newline":"LF","record_order":["record_type","semantic_key"],"trailing_newline":true},"dataset_id":"urn:uuid:c5e65e52-a7fb-507c-b5b7-185f1f13756a","dataset_version":"program-matematika-indonesia-federation-v0.1.0","file_inventory_scope":"materialized data files only; excludes federation.json and manifest.json","files":[{"bytes":86803,"path":"csv/courses.csv","role":"table_csv","sha256":"7a13774a710ac52f61c5b27ec1729aafc368f5e567aa4b23aff70d7d5ea02ecc"},{"bytes":63236,"path":"csv/datasets.csv","role":"table_csv","sha256":"7523451afd7a4e5710047fd4e68d36031fabd43733addd3130893fc13dca160f"},{"bytes":2146273,"path":"csv/identity_crosswalks.csv","role":"table_csv","sha256":"280c9f24df3322a72b54583d18a1272ee091fced205526c68fafa878221364ca"},{"bytes":2817,"path":"csv/programs.csv","role":"table_csv","sha256":"56bd948679b851600c9cde2b0e10fc3e00e07baac82424d26e835969a855707c"},{"bytes":47041,"path":"csv/publication_events.csv","role":"table_csv","sha256":"355cee5dea6fb4910cd3cd3c531d8e088ec2bff77bd6d55b6773bd5cb1cb749c"},{"bytes":13519,"path":"csv/qa_events.csv","role":"table_csv","sha256":"4494ecc200d259e8d285b36558ead791253c95237d1f4745e6f1d255c08ae96e"},{"bytes":96476,"path":"csv/reader_surfaces.csv","role":"table_csv","sha256":"9cd85af5aaa474f6f9f03fa396174a27882c2062229a504e3d0bd623eac4a320"},{"bytes":37925,"path":"csv/web_routes.csv","role":"table_csv","sha256":"eca641421ae7d7fa8411c5478c0641d7c6a5acac3d597d0d7cf5c03b017b8871"},{"bytes":78993,"path":"data/courses.jsonl","role":"table_jsonl","sha256":"7b42f428b0d1a050205db056fd80b8f62394f870da08a3d7b9658a64889a8899"},{"bytes":56215,"path":"data/datasets.jsonl","role":"table_jsonl","sha256":"c6b675c4bdeedd4b1f97bd971a40763584e4a2808b22c27cf3774c946d6643de"},{"bytes":1747371,"path":"data/identity_crosswalks.jsonl","role":"table_jsonl","sha256":"3229caec3680fb0b1ffa03c7ecd969c036ff700707e58371639d73bba2e9c718"},{"bytes":2560,"path":"data/programs.jsonl","role":"table_jsonl","sha256":"ad614f2ad7a46802eb38a5d9edf3a61e4745637c9b5f6df67e6fcb041eff68d4"},{"bytes":38169,"path":"data/publication_events.jsonl","role":"table_jsonl","sha256":"5373c6a2de6a68147ce2d748bca3790181dbe941a8f2233166762179aab7b8cc"},{"bytes":10874,"path":"data/qa_events.jsonl","role":"table_jsonl","sha256":"faff1775fe586da57ec752ff3ab91c0236357234640d55515dbb000293ef1eb1"},{"bytes":75567,"path":"data/reader_surfaces.jsonl","role":"table_jsonl","sha256":"9e5416187601b5acbd886d69ca7d67cfa3c9262cb51e6c49df2468668c235e0f"},{"bytes":32234,"path":"data/web_routes.jsonl","role":"table_jsonl","sha256":"0cf6144bb8aa437e940037bdcdc2189885faccd32e9c549161bc000f30e7162f"},{"bytes":2493810,"path":"records.csv","role":"lossless_exchange","sha256":"7a663d625f5a490f3dae3ab1b06ba82c0766d1e6919b98bb5e1a7a27d5bc0164"},{"bytes":2041983,"path":"records.jsonl","role":"records_authority","sha256":"6aa0421e45ce75dd906dd3493bdd409c5eb9d9933ffb2ffebeae197011dd1f76"}],"identity_formula":"record_type:semantic_key","identity_namespace":"7790e70a-ae6d-5cf3-b7f5-c53d7d4c0fbd","limitations":["Phase one is a compact federation registry; it does not copy owner-native content records.","For migrated corpora, adapter_sha256 binds the complete migration-receipt registration because the receipts do not uniformly expose a standalone executable-adapter hash.","Unmigrated owner datasets retain null native-schema, adapter, manifest, and record-count fields rather than inferred values.","Public course-card fragment routes are live; clean per-course and per-unit route roots remain explicitly not_published.","All 2,122 v1 IDs are preserved by crosswalk; target IDs for record types outside phase one are reserved_not_materialized.","No course-level content or search shard is claimed unless its migration receipt records a hash-bound native locator."],"lossless_csv_bytes":2493810,"lossless_csv_file":"records.csv","lossless_csv_sha256":"7a663d625f5a490f3dae3ab1b06ba82c0766d1e6919b98bb5e1a7a27d5bc0164","materialized_tables":["courses","datasets","identity_crosswalks","programs","publication_events","qa_events","reader_surfaces","web_routes"],"namespace_document":{"bytes":1817,"path":"schemas/v2/namespace-v2.json","sha256":"6bef40f71aba3900464a1352687e184f57f3b3227999feeeb2c8b2da0badacc1"},"package_id":"urn:uuid:4bf4f0b8-d917-59c6-adf3-f7af422a7815","record_count":2439,"record_counts":{"courses":40,"datasets":34,"identity_crosswalks":2122,"programs":1,"publication_events":50,"qa_events":15,"reader_surfaces":136,"web_routes":41},"recorded_at":"2026-08-25T00:00:00Z","records_bytes":2041983,"records_file":"records.jsonl","records_sha256":"6aa0421e45ce75dd906dd3493bdd409c5eb9d9933ffb2ffebeae197011dd1f76","release_policy_profile":{"bytes":2980,"path":"schemas/v2/pmi-release-policy-v2.json","sha256":"b43d2f25b61a255dc02d710b5b58202bbc2976063ffca74ee7bc34aec40e6ade"},"schema_id":"interlanguage/global-modular-mathematics-federation-package/2.0.0","schema_version":"2.0.0","source_evidence":[{"bytes":13671,"locator_base":"program_repository_root","path":"backend/migrations/applied-combinatorics-id-v1/MIGRATION_RECEIPT.json","role":"migration_receipt:applied-combinatorics-id-v1","sha256":"923781c83710d9f79759090cd97d8e751f17f5f47916f002f4885e3ffcde01cb"},{"bytes":15491,"locator_base":"program_repository_root","path":"backend/migrations/dmoi4-id-v1/MIGRATION_RECEIPT.json","role":"migration_receipt:dmoi4-id-v1","sha256":"a68e46a2b2bdce8b93630dbd2e157581a0f7a7bb03c1f509632ab7d8d3701ddb"},{"bytes":17890,"locator_base":"program_repository_root","path":"backend/migrations/hefferon-linear-algebra-id-v1/MIGRATION_RECEIPT.json","role":"migration_receipt:hefferon-linear-algebra-id-v1","sha256":"81f976c758f0453b3df1d2b07294955ccad0817b252a464df2d6b21166e4d4b0"},{"bytes":12363,"locator_base":"program_repository_root","path":"backend/migrations/judson-id-v1/MIGRATION_RECEIPT.json","role":"migration_receipt:judson-id-v1","sha256":"f00dde145fb655f147b7fa5b351af45fcd8646cc689e56cc665ac02be0b33c82"},{"bytes":16199,"locator_base":"program_repository_root","path":"backend/migrations/mathematics-in-lean-id-v1/MIGRATION_RECEIPT.json","role":"migration_receipt:mathematics-in-lean-id-v1","sha256":"f09e6fd1a8d08da1b03ed26aadad6fbf46ef26a1bdae200a4001ed5117cbd9f2"},{"bytes":25657,"locator_base":"program_repository_root","path":"backend/migrations/o002-b80-id-v1/MIGRATION_RECEIPT.json","role":"migration_receipt:o002-b80-id-v1","sha256":"ce01965df6e15bf15d38575491c11267a9cda31e2d46d58725a531eb747b4e02"},{"bytes":32459,"locator_base":"program_repository_root","path":"backend/migrations/o005-c120-id-v1/MIGRATION_RECEIPT.json","role":"migration_receipt:o005-c120-id-v1","sha256":"bacacdf31d07306174b32b7fbcff1bf054a7c4bb66591c3c5fc75bc47d4f21cc"},{"bytes":22647,"locator_base":"program_repository_root","path":"backend/migrations/o018-c130-id-v1/MIGRATION_RECEIPT.json","role":"migration_receipt:o018-c130-id-v1","sha256":"cd591df3833862551d5bbcdcfa6a1c6f22414504110b1e9fae38162dedc1ca5f"},{"bytes":9843,"locator_base":"program_repository_root","path":"backend/migrations/openlogic-id-v1/MIGRATION_RECEIPT.json","role":"migration_receipt:openlogic-id-v1","sha256":"be21c9375a2cde2199ce9709910de0c15467a2141429f5b11c7dcbef52090654"},{"bytes":21946,"locator_base":"program_repository_root","path":"backend/migrations/prealgebra2e-id-v1/MIGRATION_RECEIPT.json","role":"migration_receipt:prealgebra2e-id-v1","sha256":"50093021475d3757ab71395d5bf34f672c18a6714122093b040021c18f333152"},{"bytes":9457,"locator_base":"program_repository_root","path":"backend/migrations/tea-time-id-v1/MIGRATION_RECEIPT.json","role":"migration_receipt:tea-time-id-v1","sha256":"53230dc3294cbcfc83f643a4b8056abc3ec6a1d3799c3e0e27d01ba64c734a4f"},{"bytes":16003,"locator_base":"program_repository_root","path":"backend/migrations/yaintt-id-v1/MIGRATION_RECEIPT.json","role":"migration_receipt:yaintt-id-v1","sha256":"fa6d4636d61edee38969f39dd7f0e472cdffbfd74835c90e2a3159fa41721008"},{"bytes":3627,"locator_base":"program_repository_root","path":"backend/research/educational-access-v0.1.0/manifest.json","role":"research_support_manifest","sha256":"73a146d34615895ff209369cb650c8ea0fa36ee0bb730724ff82f63ce23956bf"},{"bytes":527214,"locator_base":"program_repository_root","path":"backend/research/educational-access-v0.1.0/records.jsonl","role":"research_support_records","sha256":"677ece52698a12d97a51bc9a725292f8fbd3be6a51c59cc40161bcf6baac5362"},{"bytes":796,"locator_base":"program_repository_root","path":"backend/research/educational-access-v0.1.0/validation_report.json","role":"research_support_validation","sha256":"ee3ab3dff26669446204ee552d1bea22f12bbf56692ccecaaed5b5dff748d355"},{"bytes":14301,"locator_base":"program_repository_root","path":"backend/v1/program-matematika-indonesia-v0.51.2/manifest.json","role":"v1_package_manifest","sha256":"06a4c070ec0bda8c419e67782cabbf960187c775f8e654d95ea9700f6a0e74b6"},{"bytes":1460112,"locator_base":"program_repository_root","path":"backend/v1/program-matematika-indonesia-v0.51.2/records.jsonl","role":"v1_identity_source","sha256":"bbd22f371d7bf58d23e4aadd3466b82a344e545d056b4706fc733a4dcdeaf7dc"},{"bytes":1986,"locator_base":"program_repository_root","path":"backend/v1/program-matematika-indonesia-v0.51.2/validation_report.json","role":"v1_validation","sha256":"cd21f9237618353235b2d060094acb99a6cdc5e576d349e0d2592d064b7989e7"},{"bytes":